{
  "timestamp": "2026-05-03T19:15:06.936Z",
  "server": {
    "script": "C:\\Users\\justi\\mcp-servers\\os-bridge\\mcp-server.js",
    "toolsDiscovered": 62,
    "includeDangerous": false
  },
  "environment": {
    "platform": "win32",
    "release": "10.0.22631",
    "node": "v24.14.0"
  },
  "summary": {
    "total": 24,
    "passed": 24,
    "failed": 0,
    "skipped": 0,
    "durationMs": 96272
  },
  "tests": [
    {
      "id": "group-a-telemetry/test-get-open-ports",
      "status": "pass",
      "durationMs": 7094,
      "notes": "Open ports shape verified",
      "details": {
        "count": 37
      }
    },
    {
      "id": "group-a-telemetry/test-get-processes",
      "status": "pass",
      "durationMs": 9428,
      "notes": "Process query respected limit and row shape",
      "details": {
        "rows": 5
      }
    },
    {
      "id": "group-a-telemetry/test-get-screen-size",
      "status": "pass",
      "durationMs": 1151,
      "notes": "Screen metrics shape validated",
      "details": {
        "monitors": 1
      }
    },
    {
      "id": "group-a-telemetry/test-get-system-info",
      "status": "pass",
      "durationMs": 3790,
      "notes": "System info keys present",
      "details": {
        "hostname": "LAPTOP-GOMKH6MT",
        "os": "Microsoft Windows 11 Home"
      }
    },
    {
      "id": "group-b-file-ops/test-file-ops-scenario",
      "status": "pass",
      "durationMs": 157,
      "notes": "file-ops-demo: scenario valid, catalog updated, MCP round-trip write→read→list all pass",
      "details": {
        "scenarioSteps": 3,
        "catalogCount": 4
      }
    },
    {
      "id": "group-b-file-ops/test-get-env-vars",
      "status": "pass",
      "durationMs": 6,
      "notes": "get_environment_vars: all-mode, prefix-filter, and named-lookup all work",
      "details": {
        "totalVarCount": 68
      }
    },
    {
      "id": "group-b-file-ops/test-list-directory",
      "status": "pass",
      "durationMs": 17,
      "notes": "list_directory: flat list, filter, recursive, and error case all pass",
      "details": {
        "count": 3,
        "recursiveCount": 4
      }
    },
    {
      "id": "group-b-file-ops/test-open-url",
      "status": "pass",
      "durationMs": 3,
      "notes": "open_url: bad-URL rejection validated; real launch skipped (pass --dangerous to enable)",
      "details": null
    },
    {
      "id": "group-b-file-ops/test-read-file",
      "status": "pass",
      "durationMs": 4,
      "notes": "read_file returned correct content",
      "details": {
        "path": "C:\\Users\\justi\\AppData\\Local\\Temp\\os-bridge-read-test-1777835632648.txt"
      }
    },
    {
      "id": "group-b-file-ops/test-write-file",
      "status": "pass",
      "durationMs": 9,
      "notes": "write_file created and appended correctly; verified via read_file",
      "details": {
        "finalSize": 23
      }
    },
    {
      "id": "group-c-input-control/test-move-mouse-gates",
      "status": "pass",
      "durationMs": 6,
      "notes": "move_mouse correctly blocked by both safety gates",
      "details": null
    },
    {
      "id": "group-e-control-state/test-control-state-transitions",
      "status": "pass",
      "durationMs": 7,
      "notes": "Control state transitions behaved as expected",
      "details": null
    },
    {
      "id": "group-e-control-state/test-execution-profile",
      "status": "pass",
      "durationMs": 3,
      "notes": "Execution profile mode toggling verified",
      "details": null
    },
    {
      "id": "group-f-visual/test-get-window-rect",
      "status": "pass",
      "durationMs": 6015,
      "notes": "get_window_rect: error case and shape validation passed",
      "details": {
        "windowTested": "Web Scraper MCP - Tool Reference - Googl",
        "rect": {
          "x": 357,
          "y": 0,
          "w": 951,
          "h": 660
        }
      }
    },
    {
      "id": "group-f-visual/test-screenshot-window",
      "status": "pass",
      "durationMs": 6240,
      "notes": "screenshot_window: fallback + real window capture both pass",
      "details": {
        "windowCaptured": "Web Scraper MCP - Tool Reference - Googl",
        "imageSizeKB": 219
      }
    },
    {
      "id": "group-g-shell-sessions/test-shell-session-lifecycle",
      "status": "pass",
      "durationMs": 1527,
      "notes": "shell_open / shell_send / shell_read / shell_list_sessions / shell_close all pass",
      "details": {
        "sessionId": "4a54c433…"
      }
    },
    {
      "id": "group-h-process-intel",
      "status": "pass",
      "durationMs": 15750,
      "notes": "Process intelligence tools returned expected structures and wait/process checks passed",
      "details": {
        "topCpuRows": 3,
        "treeNodes": 3,
        "summaryRows": 10,
        "connectionRows": 25
      }
    },
    {
      "id": "group-i-window-intel",
      "status": "pass",
      "durationMs": 12619,
      "notes": "Window intelligence tools returned expected structures and selector parity checks passed",
      "details": {
        "visibleWindows": 6,
        "focusedTitle": "Web Scraper MCP - Tool Reference - Google Chrome",
        "hierarchyNodes": 14
      }
    },
    {
      "id": "group-j-file-intel",
      "status": "pass",
      "durationMs": 23,
      "notes": "File system intelligence tools all returned expected structures",
      "details": {
        "testedTools": [
          "read_file_lines",
          "grep_file",
          "diff_files",
          "hash_file",
          "watch_file_changes"
        ]
      }
    },
    {
      "id": "group-k-diagnostics",
      "status": "pass",
      "durationMs": 7739,
      "notes": "check_service_status: Spooler found, status=Running; check_service_status: missing service correctly returned found=false; get_installed_software: 5 Microsoft entries found; get_startup_items: 9 startup items; get_event_log_entries: 5 Application log entries",
      "details": null
    },
    {
      "id": "group-l-prompts",
      "status": "pass",
      "durationMs": 8,
      "notes": "prompts/list: 6 prompts found; prompts/get automate_app: correct structure and interpolation; prompts/get find_memory_hogs: returned workflow message; prompts/get monitor_file: filePath interpolated correctly; prompts/get unknown: error correctly returned",
      "details": null
    },
    {
      "id": "group-m-contracts",
      "status": "pass",
      "durationMs": 5581,
      "notes": "write_file required-arg validation envelope passed; enum validation check passed; additionalProperties enforcement passed; success structured envelope passed; image metadata envelope passed; unknown tool envelope passed",
      "details": {
        "checks": 6
      }
    },
    {
      "id": "group-n-workflows",
      "status": "pass",
      "durationMs": 16681,
      "notes": "workflow happy path passed; workflow continueOnError path passed; workflow stopOnFail path passed; workflow recursion guard passed; continuous_mcp_improvement prompt listed",
      "details": {
        "runbookTool": true,
        "promptAdded": true
      }
    },
    {
      "id": "integration/test-clipboard-roundtrip",
      "status": "pass",
      "durationMs": 1983,
      "notes": "Clipboard roundtrip succeeded",
      "details": {
        "tokenLength": 33
      }
    }
  ]
}